[
  {
    "run_id": "0cc37aae-101b-47ad-b106-7fcda7283535",
    "timestamp": "2026-08-24T16:56:44.444569Z",
    "agent": "agent_1_relevance",
    "message": "Article extracted and confirmed relevant."
  },
  {
    "run_id": "0cc37aae-101b-47ad-b106-7fcda7283535",
    "timestamp": "2026-08-24T16:56:45.461603Z",
    "agent": "agent_2_risk",
    "message": "Risk assessment completed."
  },
  {
    "run_id": "0cc37aae-101b-47ad-b106-7fcda7283535",
    "timestamp": "2026-08-24T16:56:46.488613Z",
    "agent": "agent_3_route_retrieval",
    "message": "Candidate routes retrieved from route graph."
  },
  {
    "run_id": "0cc37aae-101b-47ad-b106-7fcda7283535",
    "timestamp": "2026-08-24T16:56:47.525852Z",
    "agent": "agent_4_ranking",
    "message": "Candidate routes ranked with ETA impact."
  },
  {
    "run_id": "0cc37aae-101b-47ad-b106-7fcda7283535",
    "timestamp": "2026-08-24T16:56:48.544698Z",
    "agent": "agent_5_advisory",
    "message": "Advisory generated; operator decision pending."
  }
]
