[
  {
    "run_id": "1434da89-9dc8-4094-b43d-01d7421222da",
    "timestamp": "2026-08-24T17:37:04.458361Z",
    "agent": "agent_1_relevance",
    "message": "Article extracted and confirmed relevant."
  },
  {
    "run_id": "1434da89-9dc8-4094-b43d-01d7421222da",
    "timestamp": "2026-08-24T17:37:05.465501Z",
    "agent": "agent_2_risk",
    "message": "Risk assessment completed."
  },
  {
    "run_id": "1434da89-9dc8-4094-b43d-01d7421222da",
    "timestamp": "2026-08-24T17:37:06.476350Z",
    "agent": "agent_3_route_retrieval",
    "message": "Candidate routes retrieved from route graph."
  },
  {
    "run_id": "1434da89-9dc8-4094-b43d-01d7421222da",
    "timestamp": "2026-08-24T17:37:07.482600Z",
    "agent": "agent_4_ranking",
    "message": "Candidate routes ranked with ETA impact."
  },
  {
    "run_id": "1434da89-9dc8-4094-b43d-01d7421222da",
    "timestamp": "2026-08-24T17:37:08.485874Z",
    "agent": "agent_5_advisory",
    "message": "Advisory generated; operator decision pending."
  }
]
