[
  {
    "run_id": "19f61c7c-231d-49a6-a775-32e2d1b3ccc4",
    "timestamp": "2026-08-24T17:44:45.590196Z",
    "agent": "agent_1_relevance",
    "message": "Article extracted and confirmed relevant."
  },
  {
    "run_id": "19f61c7c-231d-49a6-a775-32e2d1b3ccc4",
    "timestamp": "2026-08-24T17:44:46.597672Z",
    "agent": "agent_2_risk",
    "message": "Risk assessment completed."
  },
  {
    "run_id": "19f61c7c-231d-49a6-a775-32e2d1b3ccc4",
    "timestamp": "2026-08-24T17:44:47.609196Z",
    "agent": "agent_3_route_retrieval",
    "message": "Candidate routes retrieved from route graph."
  },
  {
    "run_id": "19f61c7c-231d-49a6-a775-32e2d1b3ccc4",
    "timestamp": "2026-08-24T17:44:48.618529Z",
    "agent": "agent_4_ranking",
    "message": "Candidate routes ranked with ETA impact."
  },
  {
    "run_id": "19f61c7c-231d-49a6-a775-32e2d1b3ccc4",
    "timestamp": "2026-08-24T17:44:49.627289Z",
    "agent": "agent_5_advisory",
    "message": "Advisory generated; operator decision pending."
  }
]
